{
  "contract": "app-bindings/v1",
  "app": "crm",
  "title": "CRM bindings — CustomerProfile",
  "bindings": [
    {
      "view": "customers",
      "source": "customers",
      "ops": ["list"],
      "fields": [
        { "field": "record_id", "key": "record_id", "format": "text" },
        { "field": "display_name", "key": "display_name", "format": "text" },
        { "field": "email", "key": "email", "format": "text" },
        { "field": "phone", "key": "phone", "format": "text" },
        { "field": "source", "key": "source", "format": "text" },
        { "field": "consent_email", "key": "consent.email", "format": "enum" },
        { "field": "tags", "key": "tags", "format": "tags" }
      ]
    },
    {
      "view": "customer-detail",
      "source": "customers",
      "ops": ["show"],
      "fields": [
        { "field": "record_id", "key": "record_id", "format": "text" },
        { "field": "display_name", "key": "display_name", "format": "text" },
        { "field": "email", "key": "email", "format": "text" },
        { "field": "phone", "key": "phone", "format": "text" },
        { "field": "source", "key": "source", "format": "text" },
        { "field": "consent_email", "key": "consent.email", "format": "enum" },
        { "field": "consent_sms", "key": "consent.sms", "format": "enum" },
        { "field": "tags", "key": "tags", "format": "tags" }
      ]
    }
  ]
}
